{
  "id": "llm-application-engineering",
  "title": "LLM applications, retrieval quality and safe agent boundaries",
  "description": "Connect provider-neutral model contracts to measurable retrieval, citation validation, authorization and recoverable tool effects with credential-free local fixtures.",
  "version": "1.1.0",
  "updated": "2026-10-22",
  "review_status": "Per-unit Codex AI review status and content-specific evidence in content/reviews.json; no human endorsement claimed.",
  "units": [
    {
      "id": "llm-provider-contracts",
      "title": "Model client contracts, structured outputs and bounded retries",
      "outcomes": [
        "Distinguish malformed output, refusal, rate limiting and an authorization denial",
        "Prove a retry cannot exceed the declared request budget"
      ],
      "terms": [
        {
          "term": "Provider adapter",
          "definition": "A boundary translating one service API into an application-owned request/result contract."
        },
        {
          "term": "Structured output",
          "definition": "A response constrained to a defined representation; structural validity does not establish factual or business correctness."
        },
        {
          "term": "Retry budget",
          "definition": "A finite allowance of attempts, time or resources for recovering a logical request."
        }
      ],
      "narrative": [
        "A model integration should begin with an application-owned contract. Specify the input messages, trusted caller identity, permitted source set, output schema, deadline, resource budget and observable result. Put provider-specific message formats, status codes and streaming conventions behind an adapter. A swap from one provider to another can otherwise change tool-call behavior or error handling without changing application code that assumes the old semantics.",
        "Separate transport failure, provider refusal, malformed output, unsupported capability and business rejection. A valid JSON object can still cite another tenant's document or contain an impermissible action. Validate structure and then domain rules. The fixture checks exact fields, value types and citation membership in a caller-scoped set. It explicitly does not prove that the cited text supports the answer; that requires a separate evidence check and evaluation.",
        "Retry only failures for which another attempt is both useful and safe. Rate-limit responses may include a retry delay; respect a bounded delay and the overall deadline, then add jitter in a real fleet to avoid synchronized retry bursts. Do not blindly retry a non-idempotent effect after a timeout. A model retry can generate a different tool request, so preserve the logical workflow identity and keep business-effect reconciliation outside unconstrained generation.",
        "Charge or reserve budget for every attempt, including failures according to the provider contract. The fixture reserves input plus maximum output for each attempt and stops when the local allowance is exhausted. This is intentionally conservative accounting rather than a claim about provider billing. It uses a scripted transport and fake wait callback, allowing rate limits, invalid JSON and quota exhaustion to be reproduced without a model account. Record provider/model/version and parameters in a run manifest when making real comparisons."
      ],
      "lab": "llm_contracts.py",
      "practice": [
        "Distinguish malformed output, refusal, rate limiting and an authorization denial",
        "Prove a retry cannot exceed the declared request budget",
        "Implement a provider adapter that returns an application-owned result type"
      ],
      "debugging": "If production costs jump after enabling retries, compare logical requests, provider attempts, reserved tokens and completion states separately. One frontend submit may generate several billed attempts even when the user sees one answer.",
      "tradeoffs": "A strict schema simplifies integration and can reject useful but unsupported output. Automatic repair adds latency and can repeat an unsafe request. Define repair and fallback policy explicitly rather than retrying until something parses.",
      "references": [
        "https://developers.openai.com/api/docs/guides/structured-outputs",
        "https://developers.openai.com/api/docs/guides/rate-limits",
        "https://ai.google.dev/gemini-api/docs/structured-output",
        "https://ai.google.dev/gemini-api/docs/rate-limits",
        "https://json-schema.org/draft/2020-12/json-schema-validation"
      ],
      "prerequisites": [
        "python-iteration-types"
      ],
      "estimated_minutes": 60,
      "path": "core",
      "worked_examples": [
        {
          "title": "Worked engineering case",
          "setup": "A request reserves 30 tokens per attempt from a 100-token allowance; the first attempt is rate limited.",
          "steps": [
            "Reserve 30 before the first attempt.",
            "Record the retryable failure and a bounded delay.",
            "Reserve another 30 before the second attempt.",
            "Validate the returned structure and scoped citation set."
          ],
          "result": "Two attempts consume 60 reserved tokens; the remaining allowance is 40, independently of how many user submissions were made."
        }
      ],
      "interviews": [
        {
          "question": "Does a model JSON-schema guarantee make the result safe to execute?",
          "spoken": "It guarantees only the supported structural contract. The application still checks permissions, values, ownership and state transitions.",
          "deep": "A schema can constrain an operation name and arguments but cannot establish whether the current caller may invoke that operation or whether a citation supports the generated claim. Treat model output as a proposal and validate it at the same business boundary used by ordinary callers.\n\nSeparate structure, truth and authority. In the local fixture, JSON must have exact keys and types, a nonempty supported answer and citations drawn from the caller-scoped set. Even after those checks, the source may not support the particular claim. Validate business preconditions at the ordinary application boundary before any effect. A model cannot create an approval by emitting a field named approved.\n\nWith a 100-token local allowance and 30 reserved per attempt, a rate limit followed by success leaves 40. Count attempts separately from user requests and keep actual provider billing categories separate from this conservative reservation. A useful interview defense identifies the malformed-output case that should not be retried, a retryable rate limit bounded by deadline, and an ambiguous committed effect that must be reconciled using its original identity. Run llm_contracts.py and show that forbidden citations fail even when JSON parses.",
          "follow_up": {
            "question": "When would you retry invalid JSON?",
            "answer": "Only under a bounded, explicit repair policy. Do not retry an unauthorized result or repeat an already uncertain business effect."
          },
          "rubric": [
            "States assumptions and identifies the invariant",
            "Explains one concrete failure and its observable evidence",
            "Defends an alternative and names its recovery limits"
          ]
        }
      ],
      "study_id": 834,
      "assessment": "retry-reservation-limit",
      "reviewer_status": {
        "status": "reviewed",
        "reviewer": "Codex AI technical review (user-delegated verdict; authored/self-reviewed)",
        "reviewed_at": "2026-10-22"
      }
    },
    {
      "id": "tokens-context-security",
      "title": "Token budgets, prompt contracts and untrusted context",
      "outcomes": [
        "Calculate a context budget including reserved output and tool schemas",
        "Show that malicious retrieved instructions cannot authorize a backend effect"
      ],
      "terms": [
        {
          "term": "Context window",
          "definition": "The model/API limit governing input and output tokens under its declared usage rules."
        },
        {
          "term": "Prompt injection",
          "definition": "Untrusted content attempts to redirect the system or misuse available capabilities."
        },
        {
          "term": "Instruction/data boundary",
          "definition": "An application design that keeps authoritative policy separate from external material supplied as evidence."
        }
      ],
      "narrative": [
        "Token budgeting is an accounting exercise before it is a prompting exercise. Count the actual model/API representation: instructions, conversation history, tool definitions, evidence, formatting overhead and reserved output. The rough heuristic of characters per token is useful for estimation but is not a portable hard limit across languages, encodings and models. Use a compatible tokenizer or provider count interface where available and leave a documented safety margin.",
        "Choose what to preserve when context is too large. Keep authoritative instructions and security constraints intact, select task-relevant evidence, trim obsolete conversation turns and distinguish lossy summaries from source facts. Do not silently truncate a policy condition while retaining its conclusion. A budget decision should preserve source identity and applicability metadata so the remaining text can still be interpreted correctly. Measure retrieval quality and answer quality again after changing context packing.",